{
  "$schema": "http://json-schema.org/draft-07/schema#",
  "title": "Claude Code Plugin Marketplace Registration",
  "description": "Schema for .claude-plugin/marketplace.json — marketplace listing metadata",
  "type": "object",
  "required": ["name", "owner", "metadata", "plugins"],
  "additionalProperties": false,
  "properties": {
    "name": {
      "type": "string",
      "minLength": 1
    },
    "owner": {
      "type": "object",
      "required": ["name", "email"],
      "properties": {
        "name": { "type": "string" },
        "email": { "type": "string", "format": "email" }
      },
      "additionalProperties": false
    },
    "metadata": {
      "type": "object",
      "required": ["description", "version"],
      "properties": {
        "description": { "type": "string", "minLength": 1 },
        "version": { "type": "string", "pattern": "^\\d+\\.\\d+\\.\\d+" },
        "features": {
          "type": "array",
          "items": { "type": "string" },
          "description": "Feature highlights for marketplace listing"
        }
      },
      "additionalProperties": false
    },
    "plugins": {
      "type": "array",
      "minItems": 1,
      "items": {
        "type": "object",
        "required": ["name", "source", "version"],
        "properties": {
          "name": { "type": "string" },
          "source": { "type": "string" },
          "description": { "type": "string" },
          "version": { "type": "string", "pattern": "^\\d+\\.\\d+\\.\\d+" },
          "category": { "type": "string" },
          "tags": {
            "type": "array",
            "items": { "type": "string" }
          }
        },
        "additionalProperties": false
      }
    }
  }
}
