{
  "name": "all-for-claudecode",
  "owner": {
    "name": "jhlee0409",
    "email": "relee6203@gmail.com"
  },
  "metadata": {
    "description": "Automated pipeline for Claude Code — spec → plan → implement → review → clean",
    "version": "2.12.0"
  },
  "plugins": [
    {
      "name": "afc",
      "source": "./",
      "description": "Automated pipeline for Claude Code. Automates the full development cycle: spec → plan → implement → review → clean.",
      "version": "2.12.0",
      "category": "automation",
      "tags": ["pipeline", "automation", "spec", "plan", "implement", "review", "critic-loop"]
    }
  ]
}
